{
  "$schema": "../../../STANDARD/schemas/story_dna.schema.json",
  "schema_family": "story-dna",
  "schema_version": "1.3.0",
  "project_id": "PRJ-003",
  "story_source_mode": "ORIGINAL",
  "story_dna": {
    "title": "열한 번째 인터뷰",
    "logline": "재개발 골목의 전세 게스트하우스에서 전 연인의 납치 영상이 생중계되자, 다큐멘터리 편집자는 함께 고립된 증언자들의 인터뷰 속에서 영상이 만들어지는 방식을 추적한다.",
    "central_mystery": "건물 어디에도 없는 11번 방에서 납치 영상은 어떻게 실시간으로 만들어지고 있는가?",
    "final_truth": "실종된 다큐멘터리 감독 윤서나는 게스트하우스 전체를 빌려 자신의 납치를 연출했다. 세 대의 인터뷰 카메라가 같은 검은 배경을 공유하도록 동선을 설계해, 주방 옆 옛 암실에서 촬영한 자신의 영상을 존재하지 않는 11번 방의 생중계처럼 보이게 했다. 첫 증언자 박민규가 과거의 부인 문장을 되풀이하면서 음성 트리거가 예정보다 일찍 작동했고, 그 순간부터 모든 인터뷰와 거짓말이 자동 공개되었다.",
    "mystery_type": "HOW",
    "architecture": "ARCH-02_FALSE_SOLUTION",
    "protagonist_role": "EX_PARTNER",
    "perspective": "INTERVIEW_BASED",
    "narrator_reliability": "UNRELIABLE_BIAS",
    "timeline_style": "REAL_TIME",
    "incident_type": "KIDNAPPING",
    "setting": "GUESTHOUSE",
    "setting_logic": [
      "RENOVATED_PHOTO_STUDIO_LAYOUT",
      "SINGLE_GROUP_FULL_BOOKING",
      "SHARED_CCTV_WITHOUT_AUDIO"
    ],
    "culprit_structure": "VICTIM_SELF_ENGINEERED",
    "causal_truth": "윤서나는 과거 인터뷰 원본을 없애 달라는 전 연인 강태준의 선택 때문에 내부고발자가 거짓말쟁이로 고립된 사건을 바로잡으려 했다. 자신도 조작자로 공개되어 신뢰를 잃는 대가를 감수하고, 당시 증언자들이 같은 부인 문장을 다시 말하면 원본과 현재 인터뷰가 함께 공개되도록 납치극을 설계했다.",
    "primary_twist": "TW-14_WITNESS_CAUSED_EVENT",
    "secondary_twists": [
      "TW-08_TRIGGER_WAS_TESTIMONY",
      "TW-11_VICTIM_SHARED_LOCATION"
    ],
    "information_mechanism": [
      "LIVE_INTERVIEW_FEED",
      "AUTOMATED_TRANSCRIPT_RELEASE",
      "SYNCHRONIZED_CAMERA_METADATA"
    ],
    "clue_mechanism": [
      "REFLECTED_SOFTBOX_NUMBER",
      "REPEATED_FLOORBOARD_CREAK",
      "INTERVIEW_TRANSCRIPT_ASYMMETRY"
    ],
    "motive_class": "FORCED_PUBLIC_TESTIMONY",
    "emotional_engine": "GUILT_AND_UNFINISHED_LOVE",
    "relationship_engine": {
      "primary": "BROKEN_TRUST",
      "secondary": [
        "PROFESSIONAL_BETRAYAL",
        "UNRESOLVED_AFFECTION"
      ],
      "protagonist_counterpart_role": "MISSING_DOCUMENTARIAN"
    },
    "pressure_engine": {
      "source": "SOCIAL_ISOLATION",
      "escalation": "SQUEEZE",
      "stakes": [
        "PUBLIC_CREDIBILITY",
        "PERSONAL_SAFETY",
        "UNRESOLVED_BETRAYAL"
      ]
    },
    "dramatic_engine": {
      "primary": "SACRIFICE",
      "secondary": [
        "BELIEF_REVERSAL",
        "MORAL_DILEMMA"
      ],
      "audience_emotion_curve": [
        "ALARM",
        "SUSPICION",
        "CERTAINTY",
        "DOUBT",
        "COMPLICITY",
        "BITTERSWEET_RELEASE"
      ]
    },
    "thematic_question": "진실을 지웠던 사람이 뒤늦게 진실을 공개하는 행위는 속죄인가, 또 다른 자기보호인가?",
    "audience_experience": {
      "initial_belief": "윤서나는 게스트하우스 내부 누군가에게 납치되었고 11번 방 영상은 구조를 요청하는 생중계다.",
      "midpoint_shift": "관리인 최도식이 숨겨진 암실과 CCTV 사각지대를 이용해 납치를 꾸몄다는 해답이 거의 확정된다.",
      "final_reframe": "최도식은 서나의 부탁으로 공간만 빌려준 가짜 범인이며, 사건을 실제로 시작시킨 것은 박민규가 반복한 과거의 거짓 증언이다. 서나는 같은 건물 안에서 자신의 사회적 신뢰를 대가로 원본 증언을 공개하고 있었다."
    },
    "reveal_mode": "LIVE_INTERVIEW_CROSSCUT_RECONSTRUCTION",
    "ending_type": "BITTERSWEET",
    "fair_play_contract": [
      "11번 방 표시는 객실 번호가 아니라 입력 채널 이름임을 Reveal 전에 화면에 노출한다.",
      "납치 영상의 바닥 소리와 인터뷰실 바닥 소리를 같은 순서로 들려준다.",
      "박민규의 부인 문장과 자동 공개 시작 시각을 관객이 비교할 수 있게 제시한다.",
      "윤서나가 건물 밖으로 이동하지 않았음을 확정하는 무음 CCTV 공백과 카메라 메타데이터를 함께 제시한다."
    ]
  }
}
